{
  "schema_version": 1,
  "run_id": "rtf-hf-32401077937-b32",
  "service_id": "hf-jobs",
  "status": "blocked",
  "provider": "cuda",
  "environment": "linux",
  "job_id": "6a8742efc81709766c802c68",
  "result_uri": null,
  "result_sha256": null,
  "metrics_uri": null,
  "metrics_path": null,
  "metrics_sha256": null,
  "error_code": "BENCHMARK_INFERENCE_FAILED",
  "error_message": "CUDA out of memory. Tried to allocate 3.56 GiB. GPU 0 has a total capacity of 22.03 GiB of which 2.65 GiB is free. Including non-PyTorch memory, this process has 19.38 GiB memory in use. Of the allocated memory 19.00 GiB is allocated by PyTorch, and 132.21 MiB is reserved by PyTorch but unallocated. If reserved but unallocated memory is large try setting PYTORCH_CUDA_ALLOC_CONF=expandable_segments:True to avoid fragmentation.  See documentation for Memory Management  (https://docs.pytorch.org/docs/stable/notes/cuda.html#optimizing-memory-usage-with-pytorch-cuda-alloc-conf)"
}
