{
  "schema_version": 1,
  "run_id": "rtf-runpod-32868434508-b8",
  "service_id": "runpod-pod",
  "status": "blocked",
  "provider": "cuda",
  "environment": "linux",
  "job_id": null,
  "result_uri": null,
  "result_sha256": null,
  "metrics_uri": null,
  "metrics_path": null,
  "metrics_sha256": null,
  "error_code": "BENCHMARK_SETUP_FAILED",
  "error_message": "benchmark setup did not produce a result receipt for batch 8"
}
