{
  "schema_version": 1,
  "run_id": "rtf-runpod-32633929405-b1",
  "service_id": "runpod-pod",
  "status": "blocked",
  "provider": "cuda",
  "environment": "linux",
  "job_id": null,
  "result_uri": null,
  "result_sha256": null,
  "metrics_uri": null,
  "metrics_path": null,
  "metrics_sha256": null,
  "error_code": "RUNPOD_NO_INSTANCE_AVAILABLE",
  "error_message": "RunPod Pod creation failed before remote execution: {\"error\":\"failed to create pod: graphql error: There are no longer any instances available with the requested specifications. Please refresh and try again.\",\"code\":\"graphql_error\"}"
}
