{
  "schema_version": 1,
  "run_id": "rtf-hf-32651086081-b32",
  "service_id": "hf-jobs",
  "status": "blocked",
  "provider": "cuda",
  "environment": "linux",
  "job_id": "6a8b1f1d73304676c8eca824",
  "result_uri": null,
  "result_sha256": null,
  "metrics_uri": null,
  "metrics_path": null,
  "metrics_sha256": null,
  "error_code": "BENCHMARK_INFERENCE_FAILED",
  "error_message": "CUDA out of memory. Tried to allocate 14.24 GiB. GPU 0 has a total capacity of 22.03 GiB of which 2.02 GiB is free. Including non-PyTorch memory, this process has 20.00 GiB memory in use. Of the allocated memory 19.69 GiB is allocated by PyTorch, and 85.35 MiB is reserved by PyTorch but unallocated. If reserved but unallocated memory is large try setting PYTORCH_CUDA_ALLOC_CONF=expandable_segments:True to avoid fragmentation.  See documentation for Memory Management  (https://docs.pytorch.org/docs/stable/notes/cuda.html#optimizing-memory-usage-with-pytorch-cuda-alloc-conf)\nException raised from malloc at /pytorch/c10/cuda/CUDACachingAllocator.cpp:1779 (most recent call first):\nC++ CapturedTraceback:\n#4 std::_Function_handler<std::shared_ptr<c10::LazyValue<std::__cxx11::basic_string<char, std::char_traits<char>, std::allocator<char> > > const> (), c10::SetStackTraceFetcher(std::function<std::__cxx11::basic_string<char, std::char_traits<char>, std::allocator<char> > ()>)::{lambda()#1}>::_M_invoke(std::_Any_data const&) from Logging.cpp:0\n#5 c10::Error::Error(c10::SourceLocation, std::__cxx11::basic_string<char, std::char_traits<char>, std::allocator<char> >) from ??:0\n#6 c10::cuda::CUDACachingAllocator::Native::NativeCachingAllocator::malloc(void**, signed char, unsigned long, CUstream_st*) from :0\n#7 c10::cuda::CUDACachingAllocator::Native::NativeCachingAllocator::allocate(unsigned long) from :0\n#8 at::detail::empty_generic(c10::ArrayRef<long>, c10::Allocator*, c10::DispatchKeySet, c10::ScalarType, std::optional<c10::MemoryFormat>) from ??:0\n#9 at::detail::empty_cuda(c10::ArrayRef<long>, c10::ScalarType, std::optional<c10::Device>, std::optional<c10::MemoryFormat>) from ??:0\n#10 at::detail::empty_cuda(c10::ArrayRef<long>, std::optional<c10::ScalarType>, std::optional<c10::Layout>, std::optional<c10::Device>, std::optional<bool>, std::optional<c10::MemoryFormat>) from ??:0\n#11 at::native::empty_cuda(c10::ArrayRef<long>, std::optional<c10::ScalarType>, std::optional<c10::Layout>, std::optional<c10::Device>, std::optional<bool>, std::optional<c10::MemoryFormat>) from ??:0\n#12 at::(anonymous namespace)::(anonymous namespace)::wrapper_CUDA_memory_format_empty(c10::ArrayRef<c10::SymInt>, std::optional<c10::ScalarType>, std::optional<c10::Layout>, std::optional<c10::Device>, std::optional<bool>, std::optional<c10::MemoryFormat>) from RegisterCUDA_0.cpp:0\n#13 c10::impl::wrap_kernel_functor_unboxed_<c10::impl::detail::WrapFunctionIntoFunctor_<c10::CompileTimeFunctionPointer<at::Tensor (c10::ArrayRef<c10::SymInt>, std::optional<c10::ScalarType>, std::optional<c10::Layout>, std::optional<c10::Device>, std::optional<bool>, std::optional<c10::MemoryFormat>), &at::(anonymous namespace)::(anonymous namespace)::wrapper_CUDA_memory_format_empty>, at::Tensor, c10::guts::typelist::typelist<c10::ArrayRef<c10::SymInt>, std::optional<c10::ScalarType>, std::optional<c10::Layout>, std::optional<c10::Device>, std::optional<bool>, std::optional<c10::MemoryFormat> > >, at::Tensor (c10::ArrayRef<c10::SymInt>, std::optional<c10::ScalarType>, std::optional<c10::Layout>, std::optional<c10::Device>, std::optional<bool>, std::optional<c10::MemoryFormat>)>::call(c10::OperatorKernel*, c10::DispatchKeySet, c10::ArrayRef<c10::SymInt>, std::optional<c10::ScalarType>, std::optional<c10::Layout>, std::optional<c10::Device>, std::optional<bool>, std::optional<c10::MemoryFormat>) from RegisterCUDA_0.cpp:0\n#14 at::_ops::empty_memory_format::redispatch(c10::DispatchKeySet, c10::ArrayRef<c10::SymInt>, std::optional<c10::ScalarType>, std::optional<c10::Layout>, std::optional<c10::Device>, std::optional<bool>, std::optional<c10::MemoryFormat>) from ??:0\n#15 c10::impl::wrap_kernel_functor_unboxed_<c10::impl::detail::WrapFunctionIntoFunctor_<c10::CompileTimeFunctionPointer<at::Tensor (c10::ArrayRef<c10::SymInt>, std::optional<c10::ScalarType>, std::optional<c10::Layout>, std::optional<c10::Device>, std::optional<bool>, std::optional<c10::MemoryFormat>), &at::(anonymous namespace)::empty_memory_format>, at::Tensor, c10::guts::typelist::typelist<c10::ArrayRef<c10::SymInt>, std::optional<c10::ScalarType>, std::optional<c10::Layout>, std::optional<c10::Device>, std::optional<bool>, std::optional<c10::MemoryFormat> > >, at::Tensor (c10::ArrayRef<c10::SymInt>, std::optional<c10::ScalarType>, std::optional<c10::Layout>, std::optional<c10::Device>, std::optional<bool>, std::optional<c10::MemoryFormat>)>::call(c10::OperatorKernel*, c10::DispatchKeySet, c10::ArrayRef<c10::SymInt>, std::optional<c10::ScalarType>, std::optional<c10::Layout>, std::optional<c10::Device>, std::optional<bool>, std::optional<c10::MemoryFormat>) from RegisterBackendSelect.cpp:0\n#16 at::_ops::empty_memory_format::call(c10::ArrayRef<c10::SymInt>, std::optional<c10::ScalarType>, std::optional<c10::Layout>, std::optional<c10::Device>, std::optional<bool>, std::optional<c10::MemoryFormat>) from ??:0\n#17 at::native::constant_pad_nd(at::Tensor const&, c10::ArrayRef<long>, c10::Scalar const&) from ??:0\n#18 c10::impl::wrap_kernel_functor_unboxed_<c10::impl::detail::WrapFunctionIntoFunctor_<c10::CompileTimeFunctionPointer<at::Tensor (at::Tensor const&, c10::ArrayRef<c10::SymInt>, c10::Scalar const&), &at::(anonymous namespace)::(anonymous namespace)::wrapper_CompositeExplicitAutograd__constant_pad_nd>, at::Tensor, c10::guts::typelist::typelist<at::Tensor const&, c10::ArrayRef<c10::SymInt>, c10::Scalar const&> >, at::Tensor (at::Tensor const&, c10::ArrayRef<c10::SymInt>, c10::Scalar const&)>::call(c10::OperatorKernel*, c10::DispatchKeySet, at::Tensor const&, c10::ArrayRef<c10::SymInt>, c10::Scalar const&) from RegisterCompositeExplicitAutograd_0.cpp:0\n#19 at::_ops::constant_pad_nd::call(at::Tensor const&, c10::ArrayRef<c10::SymInt>, c10::Scalar const&) from ??:0\n#20 at::native::_pad_enum_symint(at::Tensor const&, c10::ArrayRef<c10::SymInt>, long, std::optional<double>) from ??:0\n#21 at::native::pad_symint(at::Tensor const&, c10::ArrayRef<c10::SymInt>, std::basic_string_view<char, std::char_traits<char> >, std::optional<double>) from ??:0\n#22 c10::impl::wrap_kernel_functor_unboxed_<c10::impl::detail::WrapFunctionIntoFunctor_<c10::CompileTimeFunctionPointer<at::Tensor (at::Tensor const&, c10::ArrayRef<c10::SymInt>, std::basic_string_view<char, std::char_traits<char> >, std::optional<double>), &at::(anonymous namespace)::(anonymous namespace)::wrapper_CompositeImplicitAutograd__pad>, at::Tensor, c10::guts::typelist::typelist<at::Tensor const&, c10::ArrayRef<c10::SymInt>, std::basic_string_view<char, std::char_traits<char> >, std::optional<double> > >, at::Tensor (at::Tensor const&, c10::ArrayRef<c10::SymInt>, std::basic_string_view<char, std::char_traits<char> >, std::optional<double>)>::call(c10::OperatorKernel*, c10::DispatchKeySet, at::Tensor const&, c10::ArrayRef<c10::SymInt>, std::basic_string_view<char, std::char_traits<char> >, std::optional<double>) from RegisterCompositeImplicitAutograd_0.cpp:0\n#23 at::_ops::pad::call(at::Tensor const&, c10::ArrayRef<c10::SymInt>, std::basic_string_view<char, std::char_traits<char> >, std::optional<double>) from ??:0\n#24 torch::autograd::THPVariable_pad(_object*, _object*, _object*) from python_nn_functions.cpp:0\n#25 cfunction_call from ??:0\n#26 _PyEval_EvalFrameDefault from ??:0\n#27 method_vectorcall.llvm.10362965574131577162 from ??:0\n#28 _PyEval_EvalFrameDefault from ??:0\n#29 method_vectorcall.llvm.10362965574131577162 from ??:0\n#30 _PyEval_EvalFrameDefault from ??:0\n#31 _PyObject_Call_Prepend from ??:0\n#32 slot_tp_call from ??:0\n#33 _PyEval_EvalFrameDefault.warm from ??:0\n#34 method_vectorcall.llvm.10362965574131577162 from ??:0\n#35 _PyEval_EvalFrameDefault from ??:0\n#36 method_vectorcall.llvm.10362965574131577162 from ??:0\n#37 _PyEval_EvalFrameDefault from ??:0\n#38 _PyObject_Call_Prepend from ??:0\n#39 slot_tp_call from ??:0\n#40 _PyEval_EvalFrameDefault.warm from ??:0\n#41 method_vectorcall.llvm.10362965574131577162 from ??:0\n#42 _PyEval_EvalFrameDefault from ??:0\n#43 method_vectorcall.llvm.10362965574131577162 from ??:0\n#44 object_vacall.llvm.4239284753844526573 from ??:0\n#45 PyObject_CallFunctionObjArgs from ??:0\n#46 WraptBoundFunctionWrapper_call from /project/src/wrapt/_wrappers.c:3745\n#47 _PyEval_EvalFrameDefault from ??:0\n#48 method_vectorcall.llvm.10362965574131577162 from ??:0\n#49 _PyEval_EvalFrameDefault from ??:0\n#50 _PyObject_Call_Prepend from ??:0\n#51 slot_tp_call from ??:0\n#52 _PyEval_EvalFrameDefault.warm from ??:0\n#53 method_vectorcall.llvm.10362965574131577162 from ??:0\n#54 _PyEval_EvalFrameDefault from ??:0\n#55 method_vectorcall.llvm.10362965574131577162 from ??:0\n#56 object_vacall.llvm.4239284753844526573 from ??:0\n#57 PyObject_CallFunctionObjArgs from ??:0\n#58 WraptBoundFunctionWrapper_call from /project/src/wrapt/_wrappers.c:3745\n#59 _PyEval_EvalFrameDefault.warm from ??:0\n#60 gen_iternext from ??:0\n#61 _PyEval_EvalFrameDefault from ??:0\n#62 method_vectorcall.llvm.10362965574131577162 from ??:0\n#63 _PyEval_EvalFrameDefault from ??:0\n#64 PyEval_EvalCode from ??:0\n#65 builtin_exec from ??:0\n#66 cfunction_vectorcall_FASTCALL_KEYWORDS.llvm.5932654989982391144 from ??:0\n#67 _PyEval_EvalFrameDefault from ??:0\n#68 pymain_run_module from ??:0\n#69 Py_RunMain from ??:0\n#70 pymain_main.llvm.4360704852277135573 from ??:0\n#71 main from ??:0\n#72 __libc_init_first from ??:0\n#73 __libc_start_main from ??:0\n#74 _start from ??:0\n"
}
