{
  "schema_version": 1,
  "run_id": "rtf-runpod-32406128389-b32",
  "service_id": "runpod-pod",
  "status": "blocked",
  "provider": "cuda",
  "environment": "linux",
  "job_id": null,
  "result_uri": null,
  "result_sha256": null,
  "metrics_uri": null,
  "metrics_path": null,
  "metrics_sha256": null,
  "error_code": "PROVIDER_EXECUTION_FAILED",
  "error_message": "provider execution did not produce a result receipt for batch 32"
}
