{
  "schema_version": 1,
  "run_id": "rtf-hf-32359006066",
  "service_id": "hf-jobs",
  "status": "blocked",
  "provider": "cuda",
  "environment": "linux",
  "job_id": null,
  "result_uri": null,
  "result_sha256": null,
  "metrics_uri": null,
  "metrics_path": null,
  "metrics_sha256": null,
  "error_code": "PROVIDER_EXECUTION_FAILED",
  "error_message": "provider execution did not produce a result receipt "
}
