{
  "schema_version": 1,
  "run_id": "rtf-runpod-32605284539-b8",
  "service_id": "runpod-pod",
  "status": "blocked",
  "provider": "cuda",
  "environment": "linux",
  "job_id": null,
  "result_uri": null,
  "result_sha256": null,
  "metrics_uri": null,
  "metrics_path": null,
  "metrics_sha256": null,
  "error_code": "COST_GUARD_SKIPPED",
  "error_message": "skipped after an earlier batch failed; use full-matrix for explicit diagnostic expansion"
}
