{
  "schema_version": 1,
  "run_id": "rtf-hf-32457129494-b1",
  "service_id": "hf-jobs",
  "status": "blocked",
  "provider": "cuda",
  "environment": "linux",
  "job_id": "6a87fa28c81709766c80354f",
  "result_uri": null,
  "result_sha256": null,
  "metrics_uri": null,
  "metrics_path": null,
  "metrics_sha256": null,
  "error_code": "PROVIDER_EXECUTION_FAILED",
  "error_message": "HF Job did not emit RTF_RESULT_RECEIPT"
}
